{
 "ops": "0.3",
 "company": "Quillfield (demo)",
 "generated": "2026-09-27",
 "procedures": [
  {
   "ops": "0.3",
   "id": "refund-after-renewal",
   "name": "Refund request after renewal",
   "version": 4,
   "owner": "Dana M.",
   "trigger": {
    "signals": [
     "refund",
     "money back",
     "renewed",
     "renewal",
     "cancel",
     "annual charge"
    ]
   },
   "inputs": [
    {
     "name": "plan",
     "source": "Salesforce"
    },
    {
     "name": "days_since_renewal",
     "source": "Billing"
    },
    {
     "name": "amount",
     "source": "Billing"
    }
   ],
   "steps": [
    {
     "id": "r1",
     "check": "Open the renewal invoice in Billing. Note the days since renewal and the amount.",
     "evidence": 26
    },
    {
     "if": {
      "field": "plan",
      "op": "eq",
      "value": "enterprise"
     },
     "label": "Plan is Enterprise",
     "then": [
      {
       "id": "r3",
       "escalate": "Hand to the account manager in Salesforce. Do not promise a refund.",
       "owner": "Account management",
       "evidence": 5
      }
     ],
     "else": [
      {
       "if": {
        "field": "days_since_renewal",
        "op": "lte",
        "value": 30
       },
       "label": "Renewed 30 days ago or less",
       "then": [
        {
         "id": "r5",
         "do": "Issue a full refund in Billing with reason code RNW-30.",
         "evidence": 14
        }
       ],
       "else": [
        {
         "if": {
          "field": "amount",
          "op": "gt",
          "value": 2000
         },
         "label": "Credit is over $2,000",
         "then": [
          {
           "id": "r7",
           "escalate": "Request approval in #finance-approvals, then issue a prorated credit.",
           "owner": "Finance",
           "evidence": 2
          }
         ],
         "else": [
          {
           "id": "r8",
           "do": "Issue a prorated credit for the unused months.",
           "evidence": 5
          }
         ]
        }
       ]
      }
     ]
    },
    {
     "id": "r9",
     "reply": "Confirm the amount and that funds arrive in 5 to 7 business days.",
     "evidence": 26
    }
   ],
   "guardrails": [
    "Never promise an Enterprise refund in writing. The account manager decides."
   ],
   "provenance": {
    "tickets": 26,
    "agents": 5,
    "agreement": 1,
    "confidence": 0.94,
    "since": "2026-03-09",
    "sources": [
     "Slack: #support-leads · Mar 9"
    ]
   },
   "drift": {
    "open": false
   },
   "helpCenter": "KB-112"
  },
  {
   "ops": "0.3",
   "id": "payroll-bank-rejected",
   "name": "Payroll blocked by a bank rejection",
   "version": 2,
   "owner": "Ren T.",
   "trigger": {
    "signals": [
     "bank",
     "ach",
     "rejected",
     "payroll failed",
     "debit",
     "funding",
     "returned",
     "verified"
    ]
   },
   "inputs": [
    {
     "name": "bank_status",
     "source": "Payments console"
    },
    {
     "name": "hours_to_payrun",
     "source": "Payroll calendar"
    }
   ],
   "steps": [
    {
     "id": "a1",
     "check": "Open the Payments console and check the verification status of the funding account.",
     "evidence": 14
    },
    {
     "if": {
      "field": "bank_status",
      "op": "eq",
      "value": "microdeposit_pending"
     },
     "label": "Micro-deposits are still pending",
     "then": [
      {
       "id": "a3",
       "do": "Resend micro-deposits and ask the admin to verify within 24 hours.",
       "evidence": 8
      }
     ],
     "else": [
      {
       "if": {
        "field": "bank_status",
        "op": "eq",
        "value": "closed"
       },
       "label": "Account is closed or frozen",
       "then": [
        {
         "id": "a5",
         "do": "Put the pay run on hold and request a new funding account with a voided check.",
         "evidence": 2
        }
       ],
       "else": [
        {
         "id": "a6",
         "do": "Retry the debit once and attach the bank return code to the ticket.",
         "evidence": 4
        }
       ]
      }
     ]
    },
    {
     "if": {
      "field": "hours_to_payrun",
      "op": "lt",
      "value": 24
     },
     "label": "Pay run is less than 24 hours away",
     "then": [
      {
       "id": "a8",
       "escalate": "Page Payroll Ops on-call as Sev 2. Engineering does not own this.",
       "owner": "Payroll Ops on-call",
       "evidence": 5
      }
     ],
     "else": []
    }
   ],
   "guardrails": [
    "Do not send failed payrolls to Engineering. Payroll Ops owns them.",
    "Never retry a debit more than once."
   ],
   "provenance": {
    "tickets": 14,
    "agents": 5,
    "agreement": 1,
    "confidence": 0.91,
    "since": "2026-01-01",
    "sources": [
     "Slack: #payroll-ops · Jan 13"
    ]
   },
   "drift": {
    "open": false
   },
   "helpCenter": "KB-204"
  },
  {
   "ops": "0.3",
   "id": "sso-lockout",
   "name": "Admin locked out of SSO",
   "version": 1,
   "owner": "Ade O.",
   "trigger": {
    "signals": [
     "sso",
     "saml",
     "okta",
     "locked out",
     "single sign",
     "sign in"
    ]
   },
   "inputs": [
    {
     "name": "is_listed_admin",
     "source": "Account roles"
    },
    {
     "name": "idp",
     "source": "SSO settings"
    }
   ],
   "steps": [
    {
     "id": "s1",
     "check": "Confirm the requester is listed as an admin on the account.",
     "evidence": 10
    },
    {
     "if": {
      "field": "is_listed_admin",
      "op": "eq",
      "value": false
     },
     "label": "Requester is not a listed admin",
     "then": [
      {
       "id": "s3",
       "reply": "Ask a listed admin to open the request. Share no account details."
      }
     ],
     "else": [
      {
       "id": "s4",
       "do": "Verify identity by calling back the phone number on file.",
       "evidence": 10
      },
      {
       "if": {
        "field": "idp",
        "op": "eq",
        "value": "okta"
       },
       "label": "Identity provider is Okta",
       "then": [
        {
         "id": "s6",
         "check": "Check the SAML signing certificate expiry in SSO settings and send the renewal steps.",
         "evidence": 2
        }
       ],
       "else": [
        {
         "id": "s7",
         "escalate": "Move to the Tier 2 Identity queue with the IdP metadata attached.",
         "owner": "Tier 2 Identity",
         "evidence": 8
        }
       ]
      }
     ]
    }
   ],
   "guardrails": [
    "Never verify identity by email. Call back the number on file.",
    "Never reset passwords for SSO accounts."
   ],
   "provenance": {
    "tickets": 10,
    "agents": 4,
    "agreement": 1,
    "confidence": 0.86,
    "since": "2026-01-01",
    "sources": [
     "Call: Gong · Tier 2 training · Feb 20"
    ]
   },
   "drift": {
    "open": false
   },
   "helpCenter": "KB-087"
  },
  {
   "ops": "0.3",
   "id": "offboarding-export",
   "name": "Data export for a leaving customer",
   "version": 1,
   "owner": "Priya N.",
   "trigger": {
    "signals": [
     "export",
     "all our data",
     "switching providers",
     "leaving",
     "offboard",
     "payroll history"
    ]
   },
   "inputs": [
    {
     "name": "arr",
     "source": "Salesforce"
    }
   ],
   "steps": [
    {
     "id": "e1",
     "check": "Look up ARR and the renewal date in Salesforce.",
     "evidence": 9
    },
    {
     "if": {
      "field": "arr",
      "op": "gt",
      "value": 20000
     },
     "label": "ARR is over $20,000",
     "then": [
      {
       "id": "e3",
       "escalate": "Route to Retention before starting. Wait one business day for their call.",
       "owner": "Retention",
       "evidence": 4
      }
     ],
     "else": []
    },
    {
     "id": "e4",
     "do": "Generate the full export: payroll history, tax filings and employee records. Deliver within 5 business days.",
     "evidence": 9
    },
    {
     "id": "e5",
     "reply": "Share the secure download link and say it expires in 7 days.",
     "evidence": 9
    }
   ],
   "guardrails": [
    "Do not start the export before Retention has had one business day."
   ],
   "provenance": {
    "tickets": 9,
    "agents": 5,
    "agreement": 1,
    "confidence": 0.85,
    "since": "2026-01-01",
    "sources": [
     "Slack: #cx-retention · Feb 2"
    ]
   },
   "drift": {
    "open": false
   },
   "helpCenter": null
  },
  {
   "ops": "0.3",
   "id": "vip-brightwater",
   "name": "Brightwater Clinics: second review on payroll changes",
   "version": 1,
   "owner": "Theo K.",
   "trigger": {
    "signals": [
     "bonus",
     "payroll",
     "pay rate",
     "off-cycle",
     "deduction",
     "run"
    ],
    "customer": "Brightwater Clinics"
   },
   "inputs": [
    {
     "name": "customer",
     "source": "Ticket requester"
    }
   ],
   "steps": [
    {
     "if": {
      "field": "customer",
      "op": "eq",
      "value": "Brightwater Clinics"
     },
     "label": "Customer is Brightwater Clinics",
     "then": [
      {
       "id": "v2",
       "do": "Tag the ticket #vip-brightwater and make the change as a draft only.",
       "evidence": 7
      },
      {
       "id": "v3",
       "escalate": "Ask a Tier 2 lead to double-check the draft before it is submitted.",
       "owner": "Tier 2 lead",
       "evidence": 7
      }
     ],
     "else": []
    },
    {
     "id": "v4",
     "reply": "Tell the customer the change is queued for review and will be confirmed within 4 business hours.",
     "evidence": 7
    }
   ],
   "guardrails": [
    "Never submit a Brightwater payroll change without a second reviewer (contract clause 7.2)."
   ],
   "provenance": {
    "tickets": 7,
    "agents": 5,
    "agreement": 1,
    "confidence": 0.81,
    "since": "2026-01-01",
    "sources": [
     "Call: Gong · Brightwater QBR · Jan 14"
    ]
   },
   "drift": {
    "open": false
   },
   "helpCenter": null
  },
  {
   "ops": "0.3",
   "id": "duplicate-charge",